{
  "version": "0.1.0",
  "root_id": "ctx_root",
  "title": "Aurum Memory Lattice",
  "description": "Recursive visual memory map for AI context routing.",
  "nodes": [
    { "id": "ctx_root", "parent_id": null, "label": "Root Memory", "type": "root", "color": "gold", "path": "/root-memory", "summary": "Top-level memory index — route from here.", "children": ["ctx_identity","ctx_projects","ctx_health","ctx_legal","ctx_business","ctx_creative","ctx_active_tasks","ctx_archive"], "trust_level": "user_verified", "privacy_level": "private", "staleness_score": 0, "marker": { "kind": "qr", "payload": "ctx://ctx_root" } },

    { "id": "ctx_identity", "parent_id": "ctx_root", "label": "Identity", "type": "identity", "color": "gold", "path": "/root-memory/identity", "summary": "Who the user is: role, preferences, standing rules.", "children": [], "trust_level": "user_verified", "privacy_level": "private", "staleness_score": 0, "marker": { "kind": "datamatrix", "payload": "ctx://ctx_identity" } },

    { "id": "ctx_projects", "parent_id": "ctx_root", "label": "Projects", "type": "project_cluster", "color": "blue", "path": "/root-memory/projects", "summary": "Technical and product projects.", "children": ["ctx_project_agentxray","ctx_project_tutarium","ctx_project_forge","ctx_project_gildify","ctx_project_fidarium","ctx_project_contextqr"], "trust_level": "user_verified", "privacy_level": "private", "staleness_score": 0, "marker": { "kind": "datamatrix", "payload": "ctx://ctx_projects" } },

    { "id": "ctx_project_agentxray", "parent_id": "ctx_projects", "label": "AgentX-Ray", "type": "technical_project", "color": "blue", "path": "/root-memory/projects/agent-x-ray", "summary": "Model-eval gauntlet / proving ground.", "children": ["ctx_axr_round5"], "source_paths": ["/source-documents/agentxray/overview.md"], "trust_level": "source_backed", "privacy_level": "private", "staleness_score": 0.05, "marker": { "kind": "datamatrix", "payload": "ctx://ctx_project_agentxray" } },
    { "id": "ctx_axr_round5", "parent_id": "ctx_project_agentxray", "label": "Round 5 Metrics", "type": "technical_doc", "color": "blue", "path": "/root-memory/projects/agent-x-ray/round-5/metrics", "summary": "Rotating benchmark categories, variables, scoring scripts.", "children": [], "source_paths": ["/source-documents/agentxray/round5_metrics.md"], "embedding_refs": ["vec_83fd91"], "trust_level": "source_backed", "privacy_level": "private", "staleness_score": 0.03, "marker": { "kind": "datamatrix", "payload": "ctx://ctx_axr_round5" } },

    { "id": "ctx_project_tutarium", "parent_id": "ctx_projects", "label": "Tutarium", "type": "technical_project", "color": "blue", "path": "/root-memory/projects/tutarium", "summary": "Legal-AI SaaS (on legal hold).", "children": [], "trust_level": "user_verified", "privacy_level": "private", "staleness_score": 0.1, "marker": { "kind": "datamatrix", "payload": "ctx://ctx_project_tutarium" } },
    { "id": "ctx_project_forge", "parent_id": "ctx_projects", "label": "Forge / Factory", "type": "technical_project", "color": "blue", "path": "/root-memory/projects/forge", "summary": "Nexus Factory node/theme registry + assembler.", "children": [], "trust_level": "user_verified", "privacy_level": "private", "staleness_score": 0.05, "marker": { "kind": "datamatrix", "payload": "ctx://ctx_project_forge" } },
    { "id": "ctx_project_gildify", "parent_id": "ctx_projects", "label": "Gildify", "type": "technical_project", "color": "blue", "path": "/root-memory/projects/gildify", "summary": "Wealth/life OS; parent of extractions.", "children": [], "trust_level": "user_verified", "privacy_level": "private", "staleness_score": 0.05, "marker": { "kind": "datamatrix", "payload": "ctx://ctx_project_gildify" } },
    { "id": "ctx_project_fidarium", "parent_id": "ctx_projects", "label": "Fidarium", "type": "technical_project", "color": "blue", "path": "/root-memory/projects/fidarium", "summary": "Health companion (live, multi-tenant).", "children": [], "trust_level": "user_verified", "privacy_level": "private", "staleness_score": 0.05, "marker": { "kind": "datamatrix", "payload": "ctx://ctx_project_fidarium" } },
    { "id": "ctx_project_contextqr", "parent_id": "ctx_projects", "label": "ContextQR", "type": "technical_project", "color": "blue", "path": "/root-memory/projects/contextqr", "summary": "Recursive visual AI context map — this system.", "children": [], "trust_level": "user_verified", "privacy_level": "private", "staleness_score": 0, "marker": { "kind": "datamatrix", "payload": "ctx://ctx_project_contextqr" } },

    { "id": "ctx_health", "parent_id": "ctx_root", "label": "Health", "type": "health", "color": "green", "path": "/root-memory/health", "summary": "Medical / health context — sensitive.", "children": [], "trust_level": "user_verified", "privacy_level": "locked", "staleness_score": 0, "marker": { "kind": "datamatrix", "payload": "ctx://ctx_health" } },
    { "id": "ctx_legal", "parent_id": "ctx_root", "label": "Legal", "type": "legal", "color": "red", "path": "/root-memory/legal", "summary": "Legal / risk context — handle with care.", "children": [], "trust_level": "user_verified", "privacy_level": "sensitive", "staleness_score": 0, "marker": { "kind": "datamatrix", "payload": "ctx://ctx_legal" } },
    { "id": "ctx_business", "parent_id": "ctx_root", "label": "Business", "type": "business", "color": "orange", "path": "/root-memory/business", "summary": "Financial / business context.", "children": [], "trust_level": "user_verified", "privacy_level": "private", "staleness_score": 0.1, "marker": { "kind": "datamatrix", "payload": "ctx://ctx_business" } },
    { "id": "ctx_creative", "parent_id": "ctx_root", "label": "Creative Assets", "type": "creative", "color": "purple", "path": "/root-memory/creative-assets", "summary": "Games, art, brand assets.", "children": [], "trust_level": "user_verified", "privacy_level": "private", "staleness_score": 0.15, "marker": { "kind": "datamatrix", "payload": "ctx://ctx_creative" } },
    { "id": "ctx_active_tasks", "parent_id": "ctx_root", "label": "Active Tasks", "type": "tasks", "color": "cyan", "path": "/root-memory/agent-runs", "summary": "Live agent tasks and runs.", "children": [], "trust_level": "ai_inferred", "privacy_level": "private", "staleness_score": 0.1, "marker": { "kind": "datamatrix", "payload": "ctx://ctx_active_tasks" } },
    { "id": "ctx_archive", "parent_id": "ctx_root", "label": "Archive", "type": "archive", "color": "gray", "path": "/root-memory/archive", "summary": "Stale / archived context — ignore unless history requested.", "children": [], "trust_level": "stale", "privacy_level": "private", "staleness_score": 0.9, "marker": { "kind": "datamatrix", "payload": "ctx://ctx_archive" } }
  ]
}
